review,rating,date,bank,source
"Its better,but it's not complete. E.g on access to AAWSA payment,can't add another account.",4,2020-08-07,CBE,Google Play Store
"Worest apk even it doesn't show recent transactions, resending issues. The account will be reduced without showing the money I sent.",1,2024-04-21,CBE,Google Play Store
"it very interesting and easy to use & this new version is very fast to update the transaction, acct bal ,etc",5,2020-09-16,CBE,Google Play Store
"The new update is fantastic. The CBE app never looked better, faster and interactive. Good Job.",5,2020-08-16,CBE,Google Play Store
"The application do not show the real account balance on time, which shows fake balance. Its poor and offending Most of the time it shows old balance.",1,2020-10-03,CBE,Google Play Store
The up is simple and easy to use so far. And in the future updates i would recommed adding transaction statment in a report manner. Thankbyou CBE.,3,2021-06-04,CBE,Google Play Store
This is very helpful and functional app. Recently I am facing issues on transfer to other banks. Please address it,5,2021-07-27,CBE,Google Play Store
"One of the poorest app for 2 main reasons 1-works only with internet connection 2-Even with best internet acess, it usally says failed synchronization .",1,2024-06-15,CBE,Google Play Store
The new application is good interms of interface but the old one works better faster this one lags you have to work on it,1,2020-07-31,CBE,Google Play Store
It is very user friendly. I would love to see and use simillar type of appplication without internet connection. Thanks.,4,2021-03-25,CBE,Google Play Store
"This app is the best, easy and more clear to use including its features to understand so i liked it 100% because the app made the life of customers easy. Thanks cbe and the app.",5,2024-12-27,CBE,Google Play Store
Thank you for timely response. The app now working really well. Recommendations: please synchronize this app with telebirr.,4,2021-06-04,CBE,Google Play Store
This application is a step for our country. But we need to upgrade and modify it. It Continously get stucks and gives error.,5,2023-03-04,CBE,Google Play Store
it's a great app but if you can add more authentication methods like finger print and face id it will be very nice.,5,2023-10-05,CBE,Google Play Store
Good app from the old one but during sign up the old search box doesn't appear in order to activate directly from message,4,2021-01-16,CBE,Google Play Store
1. It has poor password 2. It doesn't save transaction content that pop-ups during transaction. 3. It is user friendly.,5,2023-01-10,CBE,Google Play Store
I used to do everything with it but now it says can't sync. I can not do anything with it now. I'm having difficulties. Please try to fix it,1,2022-02-12,CBE,Google Play Store
I like the new interface but gave me headache!! Most of the time it fails to sync.,2,2021-02-06,CBE,Google Play Store
The last update was good for sharing and downloading but it worsens for the history option. You have to fix it for at least 1-month history view.,4,2023-04-16,CBE,Google Play Store
"It is good service, but the service charge is not fair. I prefer to get the service in physical or ATM unless otherwise diffulty case happened.",2,2022-03-02,CBE,Google Play Store
"It's easy to use, but there is some problems sometimes when update the app in the network areas...",4,2025-01-31,CBE,Google Play Store
"It's good app, couse of shawing the debit & credit amount on time it's sometimes late if not I could have given it 5 star.",4,2022-07-25,CBE,Google Play Store
The app has good flexibility for day to day activities and stuff but it takes unessential amount of money for no valid reason which is very disappointing,3,2024-03-06,CBE,Google Play Store
System stopped suddenly from working. Very unreliable system which fails when you need it.,2,2022-02-04,CBE,Google Play Store
"it's very good and fast application sometimes there is a little bit of congestion,fix it.",5,2024-05-31,CBE,Google Play Store
App keeps on crashing after the latest update. Failures are frequent.,3,2025-02-05,CBE,Google Play Store
"This is an easy to use app; I wish it could include time of transaction, in addition to the date on the reports",4,2022-10-04,CBE,Google Play Store
Barely works. My balance never updates and I cant transfer money 90% of the time. The old app was so much better.,1,2020-09-06,CBE,Google Play Store
It shows a limited number of transaction history. And it does show transactions history in the order of arrival,1,2024-11-04,CBE,Google Play Store
the worst app and bank in Ethiopia ever. Yoy have to come to their branch to start your mobile banking and have way too high transaction fee and hidden cost for every transaction.,1,2024-01-11,CBE,Google Play Store
"Wowww, With my own mistake i was saying it works only Werkamaw Bank. But now i got real point and it works for me also Finfine Bank. I am so happy. I am doing any thing what i want very easly from out of Ethiopia. simply it is really Fantastic very usefull. Thanks our CBE Banking system",5,2021-12-27,CBE,Google Play Store
"አፕልኬሽኑ የተላከልኝን ብር ቶሎ አያሳይም ። ከ 24 ሰዓት በላይ ይቆያል። ይህ ለቢዝነስ በጣም አስቸጋሪ ሆኖብኛል። መፍትሔ አላችሁ ? This application is too slow & inactive to notify & record transactions, & hence I faced difficulty using it for businesses. would you fix it?",1,2025-01-25,CBE,Google Play Store
"It crashes a lot; it doesn't work at all sometimes. By far, it is the worst mobile banking app I have ever used.",1,2025-02-15,CBE,Google Play Store
"It's very nice app, the connection is good as well. But It only allow water bill payment for addis abeba why is that",4,2023-12-13,CBE,Google Play Store
I dont recommend this app Because when you make transfer or any transaction you dont get digtal resipt even if the transaction is done if you fix this the app is good enough,1,2022-11-04,CBE,Google Play Store
It's the most simple and yet most effective app in Ethiopia. I'm really enjoying the usability of the app.,5,2022-09-06,CBE,Google Play Store
It is a good app overall but you need to improve some features like the recent transactions section which doesn't accurately show recent transactions.,3,2024-09-07,CBE,Google Play Store
Excellent app... never had any problem in using it. Very excellent job you are doing CBE. Get going!!!!,5,2022-12-07,CBE,Google Play Store
"After updating the latest version, the app is no longer able to synchronize. Urgent fixation needed.",1,2024-02-11,CBE,Google Play Store
"It's not consistent. Now you can use , tomorrow you can't. Until then you don't know when's goin to be fixed 😕",3,2023-07-03,CBE,Google Play Store
Can not check my account! All I see is a blank screen! What is the problem?It is not user friendĺy!I will have to take my money & try other banķs.This is a waste of time!!!,1,2021-10-27,CBE,Google Play Store
I use this app all the time on my business but sometimes it is difficult to use in rural areas. because there is not enough network. so what if you prepared it for the public to use offline?,3,2025-02-09,CBE,Google Play Store
It doesn't update quickly and display balances please improve so we can rely on the online payments.,2,2024-02-23,CBE,Google Play Store
"Please bring back the reason of transfer/reference format on the receipt. Pls pls, for those of us who have multiple transactions,it's very important to trace the receipts by looking at the references.",3,2024-10-13,CBE,Google Play Store
"it's a great job.but one more thing, it hasn't been placed for transfer to other banks on face like mobile charge card place",5,2025-05-05,CBE,Google Play Store
Good application but you have to incorporate Paperless bank statement obtaining method and should abolish going to the branch whenever changing a new device and new number for activation.,4,2021-12-07,CBE,Google Play Store
"Self transfer has a problem. Doesn't tell weather trasfered or not after the process,ie ignors the final issuance of reciept .....",2,2024-11-28,CBE,Google Play Store
"Money transfer options is not giving correct input, and there is no way of knowing whether the money was successfully transferred.",2,2025-01-16,CBE,Google Play Store
The old version was bad and difficult to login. but this one is amazing and user friendly.,5,2020-08-07,CBE,Google Play Store
I have been using this app for 3 years and it was great. But now it has big problem. I can't pay bills or transfer money. Please fix it!,5,2023-03-31,CBE,Google Play Store
"Best app of the bank.But,when it needs apdate,customer must be notified in my point of view.Otherwise,customers saying ""Mobile banking is not working today"" is bad moto.",5,2025-02-10,CBE,Google Play Store
Please fix the error popping up after a successful transfer to other bank. It appears as if the transfer is not successful.,4,2024-02-13,CBE,Google Play Store
Since the last two weeks I could not see balance. It becomes busy and difficult to check remaining amount.,2,2023-03-09,CBE,Google Play Store
For the last two weeks the app is not working. Please address the issue as quickly as possible. Urgent action is needed!!,1,2024-01-25,CBE,Google Play Store
The late updates on my account after transfers that occurs sometimes is the only issue the rest of the app is excellent,4,2022-11-24,CBE,Google Play Store
Best application! You have to upgrade additional services like help to withdraw card less amount from ATM machine.,5,2024-08-26,CBE,Google Play Store
"The biggest bank in Ethiopia, still couldn't figure out a simple bank statement and transaction history. ዝፍዝፍ ሁላ",1,2024-02-04,CBE,Google Play Store
The interface of the app is great but it's very difficult to see balance and other functions. It's seems no more functional...,1,2020-09-10,CBE,Google Play Store
Now it's crashing like crazy. It doesn't even open after a recent update.,1,2025-02-01,CBE,Google Play Store
"It was good to work but It doesn't open for me, although i went twice the bank they have not found any solution.",2,2023-04-30,CBE,Google Play Store
its good app but the main problem of this app is When you change your phone or restore it you should go bank to instill the up again so imagin any time if you want change your phone you should go bank.thats to bad.,1,2022-03-25,CBE,Google Play Store
It is good for many aspect. If I can get transactions report with time duration(periodically),3,2025-03-07,CBE,Google Play Store
Its very good application specialy with 4G Network Conection. However The Service Payment is Expensive. Do It Please Justified With Our Economy Label,3,2024-10-03,CBE,Google Play Store
"Woow nice app. I think the new update is very nice because after i update it, It didnt ask me to go to branch for authorization.",5,2024-01-05,CBE,Google Play Store
I deleted the app and redownloaded it again but I couldn't connect because it asks an authorisation key number....how do I know it,2,2020-07-16,CBE,Google Play Store
"It is nice app, but I couldn't see back transactions, it is restricted for recent transactions only.",3,2024-05-19,CBE,Google Play Store
useful update but at the moment its not easy to download or update and that means we can't use the the app at the moment,3,2021-06-17,CBE,Google Play Store
"Unreliable,slow app with childish interface. Learn from other banks such as BoA to design your app and try to add more functionality.",1,2022-04-05,CBE,Google Play Store
አፑን ስጠቀም የመጀመሪያዬ ነው ..... This is one of the most user friendly app that i have ever been using on my phone ..... I wish i could give you not 5* but 55* ...keep it up !!,5,2022-05-20,CBE,Google Play Store
"really appreciate and useful 👍 app ..and happy if u can use more access to buy air tickets, get loans, ....etc...but honestly so glad to use this app..thanks",5,2020-09-02,CBE,Google Play Store
it is good app. But you have integrate cbe with cbe birr. to allow cardless withdrawal directly from our accout!,4,2025-03-31,CBE,Google Play Store
"I updated to the new version a while ago and it keeps crashing, maybe you can fix it.",3,2025-02-02,CBE,Google Play Store
"Since I have started using the application, I have saved a lot of time. It is very important application for individuals who want to save their time",5,2020-12-15,CBE,Google Play Store
"Really I like this app because it makes me a user to get service easily, moreover it saves the time for customers. Thank you CBE!.",5,2023-09-20,CBE,Google Play Store
The app notification code it's not link phone or email this means if you change phone you can't access your account easily,2,2022-07-02,CBE,Google Play Store
Perfect ui But mine is not working now days. Does something happened new? It was working well 3 day back now it say sync failed.. Are u people under mantainance??,1,2021-05-13,CBE,Google Play Store
"Though the app is a better enough in its service till now, now we can't access the service as it tells us no network and sync , thus please update it",1,2022-02-11,CBE,Google Play Store
"Best app. Easy to use, free from virus, and interesting features contained.",5,2024-02-16,CBE,Google Play Store
"Completely and utterly made it unusable after the update. Why would anyone, in their right minds, make something that worked before to a new “updated” rubbish!?",1,2019-03-05,CBE,Google Play Store
This app is very helpful because it is easy and user-friendly. It also provides different services and simplifies time to use other options.,5,2022-12-22,CBE,Google Play Store
If any developer is reading this please fix the screenshot functionality or at least the download button should work flawlessly without me touching it twenty times.,1,2025-05-05,CBE,Google Play Store
always disappointing ! especially the iOS one !! some similar local applications are extremely superior to this application!! Really disappointing!,1,2025-05-17,CBE,Google Play Store
Can we see our past transaction record more than recent on this app ??? Please it should have this option .If so tell me how if not please update thIs app soon to accommodate this to obtain as this bank deserves more and more capacity and update every day even every minutes as it represents the golden brand ETHIOPIAN!!!,1,2023-12-14,CBE,Google Play Store
"Found it easy to check payments for utility services, see payment history. Login is simple and software is easy to use.",5,2021-04-16,CBE,Google Play Store
"The app says it failed to transfer the money but it transferred money, so there is a high chance of transferring money twice.",2,2023-04-02,CBE,Google Play Store
It is not synchronizing. It was working nicely for me but now not updating my balance. Talked to the bankers but failed to solve it.,3,2022-10-01,CBE,Google Play Store
"It's great until few days back but it stop working for me starting Friday it says ""can't sycn"" please solve the problem.",4,2020-09-12,CBE,Google Play Store
Please try to work on this app. It is not user-friendly and high-end. And say this while comparing with others both within and out of the country. Please try to include more features and functionality,1,2023-04-12,CBE,Google Play Store
This version is better than than the previous one and this one didn't find strong internet connection which is its strong side.,5,2021-01-20,CBE,Google Play Store
My device install up updated all data access all function but can't support transaction i. e first login password works but can't conformation last transaction password,5,2025-02-24,CBE,Google Play Store
"It's simple, fast, easy to use and very pleasant. For me, it is a pleasant application of my bank that I always trust.",5,2023-12-14,CBE,Google Play Store
I have list of beneficiaries registered but can not transfer to them. It is throwing 'None available' message.,3,2022-11-11,CBE,Google Play Store
Recently app keeps closing and the notification after says this app has a bug. Can you make an update please,4,2025-03-31,CBE,Google Play Store
"Keep saying ""unable to connect"" after a normal phone update. Please update the app to match latest phone ""updates""",1,2025-01-07,CBE,Google Play Store
Excellent app! Like it. It's user friendly. And the last updated is also good for adding some privacy.,5,2021-06-21,CBE,Google Play Store
The New realese is just WOW every feature is very importat and mostly the verification was an important feature. Thank you CBE APP Developer team👍,4,2024-02-14,CBE,Google Play Store
Its good but Sometimes it doesn't show me my full transaction and lately we haven't been able to transfer anything,4,2022-10-22,CBE,Google Play Store
No customer service help and it's in general doesn't fill out the global app's estandard. It was felt.,1,2024-03-09,CBE,Google Play Store
Very bad app from the so called largest bank in Ethiopia. It keeps crashing after the new update and the interface is ugly.,2,2019-03-04,CBE,Google Play Store
App still crushing after entering pin! And still no response from tech support!!!!,1,2019-03-13,CBE,Google Play Store
nice app suitable to use it. the only weak side is it need data connections and hoping will be fixed to offline i gave 4 rate,4,2025-04-05,CBE,Google Play Store
The installed app says this app is rooted you can't open it whats the problem they don't know what they are doing.,1,2021-06-07,CBE,Google Play Store
it was good app since last update now doesn't work after updating… what happened? please fix the problem ASAP.,2,2019-03-04,CBE,Google Play Store
Woow!!it's very good app to done your job and it is help us any deposits‚withdrow and transfer details,5,2022-01-19,CBE,Google Play Store
"You can not track your transaction history with correct date, time and order",1,2025-01-07,CBE,Google Play Store
"The app overlaps on other apps after closing, please bring some improvements. The rest is best.",5,2022-05-25,CBE,Google Play Store
"It keeps on failing to connect to server at intervals , to solve it, install again and activate",3,2018-12-03,CBE,Google Play Store
"Absolutely the best app! It works flawlessly, anytime and anywhere.",5,2025-04-17,CBE,Google Play Store
Going to bank to get verification code won't solve security issue it's just annoying.,1,2023-10-29,CBE,Google Play Store
Great app but it would be nice if it allow cardless transaction On ATM like abyssinya bank has on its mobile app.,4,2021-10-10,CBE,Google Play Store
It's really but the pin code is short please update to lon pin or password & fingerprint Please update to new version and put the long password,5,2023-06-13,CBE,Google Play Store
One of the most useless app in the country. Doesn't work almost 99 percent of the time.,1,2024-04-13,CBE,Google Play Store
"Activation took to much of my time and initial log out was difficult, asking PIN again and again.",3,2020-09-10,CBE,Google Play Store
"Best and easy application wich i like too. But try to incorporate d/t languages .e.g Afan oromo, somale, etc. to make more easier and convince for these who do not know english and amharic. Just like cbe birr.",5,2022-09-17,CBE,Google Play Store
Except sometime break down it is good relatively and commission fee should be free to spread digitalization,5,2023-10-26,CBE,Google Play Store
Better than the old one but the utility section doesn't seem to respond to any entry. Hope it gets fixed,3,2020-08-11,CBE,Google Play Store
This app is good but could not merge multiple CBE accounts and fails to download transaction reports after the late update. Why? I am using Samsung M12.,4,2022-12-07,CBE,Google Play Store
It is a good app but sometimes very poor and i hate your rules about transfering birr only 5 times a week... We have more than 5 problem per week and it is shamefull.,3,2021-10-15,CBE,Google Play Store
Can't see the nearest Branch or ATM available,2,2025-09-08,CBE,Google Play Store
This app is good but the only difficulty with the app is it needs high speed network which makes it challenging to access it in some places,3,2024-03-01,CBE,Google Play Store
I was able to use the older version with ease. But now it doesn't even open and tells me that it can't be opened on rooted devices. Please fix that.,2,2020-09-17,CBE,Google Play Store
"First of all you need to be given a pin from a commercial bank, next you must have your bank book with you in order to be given the pin code. So I never got to use it, I just didn't want it that bad.",1,2022-05-02,CBE,Google Play Store
I really appreciate CBE app's move toward excellence. The receipt option included in CBE app's is very nice.,5,2024-02-12,CBE,Google Play Store
"I am unable to use mobile banking for around a month. It says ""None available"" when I try to transfer or buy airtime.",1,2024-04-22,CBE,Google Play Store
"After a recent update, this app stopped working with a message "" the developer turned off advanced ... etc.",3,2025-01-23,CBE,Google Play Store
It doesn't work and sync when you want to use and transfer money to others. Why CBE is not working to solve the problem.,4,2020-09-23,CBE,Google Play Store
"The new update is horrible. Unreliable. I can't send money nor check my balance. Set your priorities straight, CBE",1,2024-02-13,CBE,Google Play Store
This up is very good only problem is no access of seeing your balance Otherwise it is very easy to you use and its so fast just work on that above mentioned Stay blessed 🙏🙏🙏❤️,5,2022-09-03,CBE,Google Play Store
Most of the things work just fine. But the transaction history doesn't work properly/right.,2,2024-01-15,CBE,Google Play Store
"what a nice!. user friendly, easy to access, updated, Amharic supported, error solved and well developed app.",5,2020-06-29,CBE,Google Play Store
"- It is best application , but you have to integret the tele- birr service to any mobile service number by titening the security tunnels rather than own mobile service number only",3,2024-04-29,CBE,Google Play Store
Easy and fast but some time it show us error but the trasaction is alrady sent and the error mislead us and we do the trx again. This affect our acount twice,5,2021-10-15,CBE,Google Play Store
"Pretty straightforward, does what it's supposed to do. Wish it had beefier/ more detailed recent transactions though.",4,2024-11-25,CBE,Google Play Store
Good service for me because it saves my time. There's no need to go to the brunch to transfer the money my bank is going to anywhere with so I can do anything on my mobile banking.thanks for your service.,5,2024-12-13,CBE,Google Play Store
"it's not best like abyssinya mobile bank. This not show the transaction and didn't get notification , SMS text.",3,2024-09-09,CBE,Google Play Store
The Updated version of the app is awesome. Really Enjoyable to got sealed Receipts with barcode.🙏🙏,5,2024-02-12,CBE,Google Play Store
"Continuous updates of the app makes it easy, fast, and secure to use. I feel safe and secured to use this app. Thanks CBE🙏",5,2024-02-11,CBE,Google Play Store
Wow! This last update solved the problem of some system compatibility issues. now it works fine. thanks?,4,2020-09-22,CBE,Google Play Store
Weak update ! . b/c it stops when I want to set two step verification on. And it is only applicable if developer options are on. Why ??? Please tell me the reason 🙏,1,2024-12-31,CBE,Google Play Store
It has been improved tremendosly. I am now comfortable to use it anytime I want. Good job CBE team.,5,2021-11-18,CBE,Google Play Store
Nice app but the transaction history is not accurate and it doesn't sync at times.,3,2024-02-16,CBE,Google Play Store
I don't Like this app and there service fee is highl,5,2025-08-23,CBE,Google Play Store
WOW I am so impressed using this App. It is simple to use and helps digital money transaction.,5,2021-06-24,CBE,Google Play Store
"Good app. Can you add option to print or save ""Recent Transaction page"".",5,2022-02-13,CBE,Google Play Store
why i must visit the branch i opened my account to activate the mobile banking services? if it a connected network it maybe done from any branch.,1,2025-09-20,CBE,Google Play Store
"Alert The device developer Mode is turned on. You can't use this app, Please turn off Developer Mode and try again. OK Why reason?",1,2025-01-11,CBE,Google Play Store
"The most recent update is so impressive that Stops stucking,Speedy transaction.Thanks and keep updating.",4,2023-03-09,CBE,Google Play Store
Well designed user interface and easy to use! Great app! Good job developers!✔✔✔,5,2020-09-11,CBE,Google Play Store
"Better if we can have an option to save other bank accounts, like we save beneficiaries having CBE accounts. Let's have an option to add beneficiaries with other bank accounts.",4,2022-10-11,CBE,Google Play Store
The frequent changing of the app by the developers and stop of mobile banking app is disturbing and disappointing. Why do this keep happening?,4,2020-08-07,CBE,Google Play Store
The connection between bank and the app is lag relationship this must be corrected.,4,2025-08-25,CBE,Google Play Store
"No update available doesn't,'t show balance, no transfer available useless and a waste of time",1,2023-06-17,CBE,Google Play Store
Nice and very useful app i like it!,5,2025-11-13,CBE,Google Play Store
It has very good function.the challenge with it is : it asks a varification key every time you install even for same device.,3,2024-02-01,CBE,Google Play Store
It would be really awesome if it had an export to csv file option on recent transactions.,4,2022-04-20,CBE,Google Play Store
After the recent update the application is getting crashed. Kindly fix the bug soon.,1,2019-03-14,CBE,Google Play Store
I love this application it is easy to use and fast . i recomed that it may use with out network if it is possible,5,2024-01-10,CBE,Google Play Store
I liked this app. But the User interface is very basic and not attractive at all.,2,2025-06-07,CBE,Google Play Store
