review,rating,date,bank,source
Best App.I have used for many years.,5,2022-06-05,CBE,Google Play Store
Why not access in galaxy s7 edge??,5,2024-07-31,CBE,Google Play Store
It has improved much since I reviewed last time.,4,2021-12-20,CBE,Google Play Store
I LIKED THIS APP 😊MAY IT WILL NEW UPDATIONS SOON THANKS😊,5,2023-01-29,CBE,Google Play Store
Wonderfully make your lifrle simple,5,2021-06-05,CBE,Google Play Store
"It is very good, it make my life easy !!",4,2022-04-08,CBE,Google Play Store
It's doesn't work properly.,1,2020-12-01,CBE,Google Play Store
"Please help me,this apps do with mobile data",5,2023-11-08,CBE,Google Play Store
The best application I have ever seen in Ethiopia banking industry.,5,2025-04-17,CBE,Google Play Store
The best experience ever I have seen. Keep it up.,5,2024-04-06,CBE,Google Play Store
Pleas update this app is not working,2,2023-06-30,CBE,Google Play Store
Best and ease to use,5,2025-01-24,CBE,Google Play Store
Why is this app not showing money transfer to other people?,1,2023-03-31,CBE,Google Play Store
The app is not functioning for me. Please assist.,4,2022-02-11,CBE,Google Play Store
crashes after update for v2. please reply for comments asap.,1,2019-03-17,CBE,Google Play Store
"The activatin code that i got from the bank doesn't work, 😡",1,2020-12-31,CBE,Google Play Store
Easy to manage,5,2021-03-21,CBE,Google Play Store
Very nice and attractive application,5,2024-08-09,CBE,Google Play Store
Very nice app thanks for the create,5,2024-03-26,CBE,Google Play Store
I dont wanna give even one star it's annoying,1,2022-02-07,CBE,Google Play Store
Dear cbe this app is not comparable with 21century and pls try to solve it.💀💀💀,1,2025-04-01,CBE,Google Play Store
It might be fake be aware (it’s not working),1,2024-12-17,CBE,Google Play Store
Better than the previous version. The update is good 👍,5,2024-03-11,CBE,Google Play Store
Not seen money send to agent why?,5,2022-04-02,CBE,Google Play Store
It works for me very well. Thanks!,5,2023-12-03,CBE,Google Play Store
Excellence and facilitant spp,5,2024-04-04,CBE,Google Play Store
It has speed than the others,5,2023-11-01,CBE,Google Play Store
Biometric security for mobile banking is not available,5,2025-04-16,CBE,Google Play Store
Does not work after update,1,2019-03-29,CBE,Google Play Store
What an update its amazing Super Fast,5,2021-06-11,CBE,Google Play Store
Horrible can't sync my account,1,2021-08-18,CBE,Google Play Store
Please add an option transfer to other tellebirr wallet,5,2024-02-27,CBE,Google Play Store
I love you this app,5,2025-11-19,CBE,Google Play Store
It is so bad to fast buy,1,2024-02-05,CBE,Google Play Store
What a helpful and latest app!,5,2023-09-19,CBE,Google Play Store
Fast transaction really,5,2023-10-17,CBE,Google Play Store
Not working @ all! 😡😡😡 Older version was much more better!,1,2023-03-15,CBE,Google Play Store
I like this app because it makes everything possible,5,2023-10-24,CBE,Google Play Store
It is very good. I enjoy using it.,5,2024-03-09,CBE,Google Play Store
Good Application but it stops sametime,5,2020-11-02,CBE,Google Play Store
it is good up to now but it needs update today,5,2025-07-18,CBE,Google Play Store
they been freezing a transfered money till the time they chose chose it to be delivered bruh,1,2025-07-30,CBE,Google Play Store
really am happy to this app it is Siple to use everything,5,2025-06-07,CBE,Google Play Store
"Good but currently not update, the status",4,2023-11-18,CBE,Google Play Store
Not working properly,2,2021-11-25,CBE,Google Play Store
it is like a childish app make it better the worst I have ever seen,1,2025-06-02,CBE,Google Play Store
"The worst Bank, system and app ever in Ethiopia.",1,2025-07-02,CBE,Google Play Store
very useful to use it from any where in the world !,5,2025-08-07,CBE,Google Play Store
Gena salgeba new verification miteyikegn keyet endametaw new??,1,2024-01-06,CBE,Google Play Store
For me it was really comfortable 😌,5,2022-02-12,CBE,Google Play Store
it's good but add some more please,3,2025-08-08,CBE,Google Play Store
Very easy to use,5,2025-08-02,CBE,Google Play Store
this APK Best for most of people,5,2025-08-13,CBE,Google Play Store
The best of mobile banking in Ethiopia 🇪🇹,5,2025-07-06,CBE,Google Play Store
It's good to have this app for easy use,5,2022-02-12,CBE,Google Play Store
"""Why don’t your ATMs support account-to-account transfers like other countries( Kenya, Nigeria , South africa)""",4,2025-06-06,CBE,Google Play Store
very nice to use this app,5,2025-06-14,CBE,Google Play Store
very good thanks for services,1,2025-06-30,CBE,Google Play Store
it is the best transferring AP,5,2025-08-08,CBE,Google Play Store
best and secured application,5,2025-08-23,CBE,Google Play Store
It is user friendly.,4,2025-07-11,CBE,Google Play Store
You improved the service of this app much better.,5,2022-10-20,CBE,Google Play Store
You do good on upgrading the app keep it up👍,4,2020-10-18,CBE,Google Play Store
why can't I transfer money to telebirr?,4,2025-07-12,CBE,Google Play Store
It is best app but samtime busy,5,2022-05-16,CBE,Google Play Store
This application is excellent .,5,2025-08-22,CBE,Google Play Store
the system works even from wherever I am abroad CBE☆☆☆☆☆,5,2025-06-15,CBE,Google Play Store
it's good app,5,2025-10-14,CBE,Google Play Store
Interbank transaction is not functional.,3,2021-10-08,CBE,Google Play Store
Why is problem non available,2,2023-12-24,CBE,Google Play Store
Easy and safe app,5,2024-02-07,CBE,Google Play Store
The best one ever i've seen.,5,2025-08-01,CBE,Google Play Store
My most optional bank,5,2025-11-17,CBE,Google Play Store
It is hard to open,1,2024-04-13,CBE,Google Play Store
what nice app i never usedyet,4,2025-08-20,CBE,Google Play Store
Nice application Good job for commercial bank of ethiopia,5,2023-09-30,CBE,Google Play Store
That is good bank but there is something wrong 😕,2,2023-03-04,CBE,Google Play Store
CBE Mobile Banking make us our life easier.,5,2025-07-12,CBE,Google Play Store
It's easy for the customer,4,2023-07-01,CBE,Google Play Store
So bad now and hard to use,5,2025-06-09,CBE,Google Play Store
"not good, not bad!",3,2025-10-23,CBE,Google Play Store
why i cant screen shoot ?,1,2025-07-20,CBE,Google Play Store
Our Commercial Bank of Ethiopia is Good !,5,2025-10-06,CBE,Google Play Store
i like this√,4,2025-11-16,CBE,Google Play Store
Thank you for your service......great app i am enjoying it.,5,2022-12-09,CBE,Google Play Store
This App. Is just a Meaningful Application for our country..,5,2025-02-04,CBE,Google Play Store
"it says ""ti is work any more in your device"" what can i do??",1,2025-10-18,CBE,Google Play Store
"the most disgusting app,",1,2025-08-07,CBE,Google Play Store
Why is this app not working out of Addis Ababa?,1,2021-05-03,CBE,Google Play Store
best mobile banking app,5,2025-06-26,CBE,Google Play Store
Best app. Improved speed,5,2020-09-12,CBE,Google Play Store
Its not working on my mobile,1,2021-11-23,CBE,Google Play Store
"Bad, it's not working for me since one week",1,2024-02-07,CBE,Google Play Store
"The increase in the amount of the Daily Exchange should be increased to 6,000,000 ETB instead of 600,000 ETB.",4,2024-09-28,CBE,Google Play Store
Fast and accurate,5,2022-04-06,CBE,Google Play Store
I used morethan one year,4,2025-11-20,CBE,Google Play Store
Application is very important for us thanks,5,2023-04-30,CBE,Google Play Store
Good easy and fast,5,2022-05-20,CBE,Google Play Store
this update crashes please do something,1,2019-03-05,CBE,Google Play Store
Easy to use everywhere,5,2022-02-12,CBE,Google Play Store
"It helps a lot,thanks",4,2020-09-07,CBE,Google Play Store
best 100 %,5,2025-11-10,CBE,Google Play Store
It's easy and convenient 🙌,5,2024-12-17,CBE,Google Play Store
Ilike this app because it is fast and easy,5,2021-10-16,CBE,Google Play Store
"Crashes after update, shame.",1,2019-03-12,CBE,Google Play Store
Fast and user friendly,5,2023-12-31,CBE,Google Play Store
its not working properly boring app ever,1,2024-07-23,CBE,Google Play Store
It ask me your developer mode is on and its not working for me???,1,2025-01-01,CBE,Google Play Store
"Nice platform, thanks.",5,2020-10-13,CBE,Google Play Store
The application is not user freindly at all,2,2020-08-25,CBE,Google Play Store
It slow and unused app,1,2025-01-02,CBE,Google Play Store
"Please, still now, I am not accepting codes for activation of my account. help",5,2024-02-22,CBE,Google Play Store
"Not Good, too lame to use",1,2025-03-21,CBE,Google Play Store
More or less it is Good Application.Go Ahead.,5,2024-06-24,CBE,Google Play Store
Doesn't work after update,1,2023-03-31,CBE,Google Play Store
Good but you must improve it,5,2022-08-17,CBE,Google Play Store
Nice and easy app,5,2022-02-12,CBE,Google Play Store
Couldn't see any thing.even i can't see my balance.,1,2021-08-25,CBE,Google Play Store
It did not worked for me irrespctive of Internet connection!,1,2020-08-09,CBE,Google Play Store
"I like it, it save time and mekes me trustful friend.",3,2020-11-10,CBE,Google Play Store
very limited option we could see the previous transactions.,2,2021-08-09,CBE,Google Play Store
It's amazing app easy to use,5,2021-08-18,CBE,Google Play Store
it's very low quality application,1,2025-05-04,CBE,Google Play Store
"very good, keep it up",5,2025-03-31,CBE,Google Play Store
I am unable to open or use the application,2,2024-11-08,CBE,Google Play Store
"Good job, try your best. You can do anything you need.",5,2023-11-24,CBE,Google Play Store
"best, simple, efficient ...... 👏👏👏👏👏👏",5,2023-09-09,CBE,Google Play Store
Easy & Perfect app,5,2022-02-13,CBE,Google Play Store
bring back the screenshot feature.,1,2025-04-05,CBE,Google Play Store
First of all may almighty God bless the leader and mother of Africa Ethiopia and the people as well. Congratulations to ECB for sharing very interested and helpful application and more early to use Thanks,5,2023-12-22,CBE,Google Play Store
Really it is fast!,4,2022-06-09,CBE,Google Play Store
"hello,all ethiopian to east africa and all over the world.i am from ethiopia.i wos have disegned new digital transaction system in ethiopia.this our money transaction to be active when we need all our transaction to any where.this is also exellent way to connect by digital transaction with global country.......like china...us...italy....phli....etc through the world...we have been lucky by making a great digital connection system to develop our CBE birr with global transaction...in ethiopia...",5,2024-11-10,CBE,Google Play Store
Good application and Best for use,5,2024-07-25,CBE,Google Play Store
"No text, no update.....",1,2024-12-31,CBE,Google Play Store
Recently it is not working please check it,2,2025-02-26,CBE,Google Play Store
Always sync failed,1,2020-08-25,CBE,Google Play Store
I cannot access the services to transferor to pay my bills,1,2023-02-14,CBE,Google Play Store
good app and very inspiring,5,2024-02-06,CBE,Google Play Store
Not user-friendly.,1,2024-01-08,CBE,Google Play Store
It's recommended to use this any other banking system,5,2022-02-13,CBE,Google Play Store
Not working at all!,1,2021-08-16,CBE,Google Play Store
the most boring Mobil banking application in ethiopia.Please use alternative private banks mobile banking apps,1,2025-05-22,CBE,Google Play Store
Doesn't work for Samsung A30s!,1,2021-08-11,CBE,Google Play Store
it is good but sometime not working,5,2024-02-06,CBE,Google Play Store
Fast and Reliable,5,2025-04-18,CBE,Google Play Store
Góod and easy app,3,2023-08-23,CBE,Google Play Store
still now not not showing my balance but it open,3,2020-08-19,CBE,Google Play Store
Very good app. Thanks,5,2021-06-26,CBE,Google Play Store
I used for more than two years although needs improvements...,5,2024-08-27,CBE,Google Play Store
This app have not working please more approve it.,5,2024-03-12,CBE,Google Play Store
Easy and time consuming,1,2022-10-24,CBE,Google Play Store
not responsive most of the time.,2,2023-12-01,CBE,Google Play Store
Good application and helpful,5,2023-10-15,CBE,Google Play Store
The APP is very fast that is good,4,2024-02-16,CBE,Google Play Store
Best of all mobile bank,5,2024-02-14,CBE,Google Play Store
simplest app. that i have ever used..,5,2024-12-27,CBE,Google Play Store
I like and satisfy by using commercial bank of Ethiopia thanks,5,2024-02-13,CBE,Google Play Store
Nice and smooth,5,2022-09-24,CBE,Google Play Store
Why did this application stopped working at the moment,1,2025-01-04,CBE,Google Play Store
Need better Work on system,5,2024-03-20,CBE,Google Play Store
It's not working please make it something,1,2020-11-30,CBE,Google Play Store
I like this application and It's very useful,1,2024-05-19,CBE,Google Play Store
The best banking and application,5,2024-11-18,CBE,Google Play Store
Very late the only app is never seen in my life,1,2022-11-03,CBE,Google Play Store
It's good and perfect app,1,2024-02-26,CBE,Google Play Store
Why developer option is off ? Please remove this feature.,4,2025-01-24,CBE,Google Play Store
I am Orthodox Christian but why on earth you think only Muslims use interest free accounts. Shame on you,1,2022-06-26,CBE,Google Play Store
Best app that constitutes all in one.,5,2023-11-03,CBE,Google Play Store
I am students of accounting and finance when i graduate i wish to do in CBE thanks,5,2025-01-23,CBE,Google Play Store
The best app 👌 I love it easy to use,5,2022-02-18,CBE,Google Play Store
best app and update more features *****,5,2025-03-23,CBE,Google Play Store
It's good app and upgrade day to day thanks i given five star okay ❤️,5,2023-10-30,CBE,Google Play Store
Not functional our mobile,1,2021-07-12,CBE,Google Play Store
Very easy to use,5,2021-10-29,CBE,Google Play Store
Very easy to use,5,2021-09-24,CBE,Google Play Store
service part is not working,1,2021-05-18,CBE,Google Play Store
This app is one of the best mobile banking in 🇪🇹,5,2024-02-15,CBE,Google Play Store
Not working very well,1,2024-02-18,CBE,Google Play Store
this app is not functional for some phones,1,2021-08-17,CBE,Google Play Store
fantastic and very helpful,5,2024-11-12,CBE,Google Play Store
Good and comfortable,5,2024-07-07,CBE,Google Play Store
No way to give negative feedback. toughen up!,5,2024-01-06,CBE,Google Play Store
have no option for transaction export,1,2024-05-01,CBE,Google Play Store
The most comfortable app... fast booom 🥰🥰,5,2024-01-07,CBE,Google Play Store
This app is best and safe secure,4,2023-04-20,CBE,Google Play Store
App is not working,1,2024-10-19,CBE,Google Play Store
I looke best application to work in the future,2,2021-10-05,CBE,Google Play Store
Just wish it has a dark mode.,4,2023-09-09,CBE,Google Play Store
Best & easy app!,5,2024-12-14,CBE,Google Play Store
It is not working. The previous was better.,1,2023-06-15,CBE,Google Play Store
Very smart financial apps,5,2024-03-08,CBE,Google Play Store
I like this application and your Banking systems,5,2024-11-07,CBE,Google Play Store
Its good but it dosnt show updated statment,3,2024-04-05,CBE,Google Play Store
I like it more the app cbe thank you !,5,2025-01-27,CBE,Google Play Store
It is busy more time why is it?,3,2024-02-23,CBE,Google Play Store
Really great app!!!,5,2022-07-11,CBE,Google Play Store
Very easy to use,5,2021-01-01,CBE,Google Play Store
It is most popular app in our company,5,2023-09-06,CBE,Google Play Store
Gorgeous app i really like this app.,5,2024-03-15,CBE,Google Play Store
This app doesn't work on my Samsung J6.,1,2022-02-23,CBE,Google Play Store
Really thank for your service,5,2024-04-25,CBE,Google Play Store
Great !!! I am happy for this app.,5,2024-05-01,CBE,Google Play Store
Intersting and real app,5,2023-09-16,CBE,Google Play Store
Best solution for easy life !,4,2024-03-18,CBE,Google Play Store
Why there is no ussd service for mobile banking.,2,2022-10-08,CBE,Google Play Store
App. With a good performance,4,2023-09-09,CBE,Google Play Store
It fast and satisfied,5,2025-01-08,CBE,Google Play Store
App is not working for days now.,1,2024-10-03,CBE,Google Play Store
It's not working properly,1,2021-01-04,CBE,Google Play Store
Fast and secure,5,2024-03-30,CBE,Google Play Store
It is perfect it helps me more ......,5,2023-09-07,CBE,Google Play Store
"It is best, recommend you guys to use.",5,2024-06-27,CBE,Google Play Store
It's very suitable app for using,5,2024-08-21,CBE,Google Play Store
Better than the other CBE system to send money.,5,2023-03-04,CBE,Google Play Store
That's so wonderful and secure,3,2024-02-13,CBE,Google Play Store
From these week App is not functional,5,2023-12-26,CBE,Google Play Store
BalanceDear Customer your Account 1********8778 has been debited with ETB 6000. Your Current Balance is ETB 14800000.1. Thank you for Banking with CBE!,5,2023-07-04,CBE,Google Play Store
It is good but not fast,1,2024-04-14,CBE,Google Play Store
It has simply simplified my life..i love it.,5,2022-04-25,CBE,Google Play Store
Good to have this app on my phone.,5,2024-03-21,CBE,Google Play Store
this update is was not working,1,2019-03-07,CBE,Google Play Store
very good for security,5,2024-12-21,CBE,Google Play Store
Very very bad app so embarrassing,1,2022-06-05,CBE,Google Play Store
"Please include a mechanism to sort out a statement for a transaction with a single person or enterprise, on ur cbe birr or mobile banking",3,2023-07-21,CBE,Google Play Store
I really luv this app it's makes life get easy,5,2021-02-02,CBE,Google Play Store
always network error why ....,1,2024-03-16,CBE,Google Play Store
Really Simple and Secured,5,2022-04-25,CBE,Google Play Store
Very Very good appa I am really,5,2023-11-19,CBE,Google Play Store
Short and Great app,5,2024-05-15,CBE,Google Play Store
Excellent app but not CBE,5,2023-03-06,CBE,Google Play Store
This online application good my life support all of us to get,5,2023-11-13,CBE,Google Play Store
this app really helped me a lot,5,2024-04-09,CBE,Google Play Store
Am happy for the service,4,2024-10-03,CBE,Google Play Store
Its really good app i have ever have in ethiopia,5,2021-04-27,CBE,Google Play Store
Bast app I know I don't forget this app in my bank account,5,2024-05-16,CBE,Google Play Store
Since I updated the app its not working,2,2024-02-11,CBE,Google Play Store
The Security is too short,5,2023-10-31,CBE,Google Play Store
Waww very good app I like it!!,5,2023-10-14,CBE,Google Play Store
It perfect and good app for me,5,2024-01-28,CBE,Google Play Store
It is not working still now,1,2022-02-13,CBE,Google Play Store
Working doing fastly,5,2025-01-01,CBE,Google Play Store
I like it and that is exceptional,4,2023-08-28,CBE,Google Play Store
What does it mean can't sync,4,2021-06-20,CBE,Google Play Store
Is best app in ethiopia there is avaliable for next time,1,2021-08-31,CBE,Google Play Store
The best and active app ever,5,2021-08-31,CBE,Google Play Store
Wow! This is how to make life easier!,5,2022-03-25,CBE,Google Play Store
The new version of the app is awesome!,4,2020-08-06,CBE,Google Play Store
I like it for overall services,4,2025-01-01,CBE,Google Play Store
Can't update anytime pleas make it better,1,2020-11-21,CBE,Google Play Store
Its amazing feature good CBE,5,2020-08-08,CBE,Google Play Store
It is good but not sufficient !!,5,2024-11-09,CBE,Google Play Store
App is don't show balance,1,2024-01-01,CBE,Google Play Store
Amazing app I ever see in this territory,5,2024-05-05,CBE,Google Play Store
It is very good app tanks,5,2021-04-08,CBE,Google Play Store
The only best app from cbe's tech,5,2022-02-25,CBE,Google Play Store
This version is so slow,1,2023-03-09,CBE,Google Play Store
Keep it up...i love it,5,2023-11-06,CBE,Google Play Store
This should run for worst app of the year,1,2025-01-31,CBE,Google Play Store
Please include full Bank statement access through this app,2,2023-11-20,CBE,Google Play Store
It makes my life easy. I love it,5,2021-05-19,CBE,Google Play Store
Transfer checking balance utility service,5,2022-12-13,CBE,Google Play Store
"It's good, and helped me alot",5,2022-10-07,CBE,Google Play Store
"Good, Improve App Always",4,2021-04-22,CBE,Google Play Store
It has serious synchronisation problem,1,2020-09-18,CBE,Google Play Store
This app is not compatible for Samsung not,5,2021-08-17,CBE,Google Play Store
Good but I couldn't receive verification key,5,2021-11-01,CBE,Google Play Store
Best mobile banking App,5,2022-04-12,CBE,Google Play Store
App doesn't work.,1,2019-03-04,CBE,Google Play Store
Excellent to use am happy,5,2021-03-19,CBE,Google Play Store
This app is help as more and more,5,2024-02-11,CBE,Google Play Store
I always like this banking app,5,2023-01-30,CBE,Google Play Store
Very nice and easy,5,2021-03-27,CBE,Google Play Store
what is going on with this app it's not working at all,1,2019-03-15,CBE,Google Play Store
I am happy with the app & Satisfied !,5,2023-04-06,CBE,Google Play Store
Good app but not fast,4,2022-02-12,CBE,Google Play Store
Good app but sometimes its down,3,2021-07-25,CBE,Google Play Store
It is bad and the app made my phone to behave bad,1,2023-07-21,CBE,Google Play Store
Good work at all,5,2021-10-07,CBE,Google Play Store
The Best optional application !,5,2023-02-14,CBE,Google Play Store
Amazing app.l like it!!,5,2021-03-25,CBE,Google Play Store
This app makes my job easier.,5,2022-06-15,CBE,Google Play Store
Wow amazing app for all!❤️,5,2023-11-25,CBE,Google Play Store
Ever and never seen this kind of app I proud my CBE,5,2025-03-31,CBE,Google Play Store
Safe and fast thanks,5,2020-10-29,CBE,Google Play Store
I can't update the app on my mobile,3,2023-11-14,CBE,Google Play Store
Its easy and comfortable thanks,5,2024-07-12,CBE,Google Play Store
The last update is useless!!,1,2024-12-31,CBE,Google Play Store
Easy and fast 👌,5,2024-02-28,CBE,Google Play Store
Easy and fast,5,2024-02-02,CBE,Google Play Store
Fast and very latest!!!,5,2022-11-23,CBE,Google Play Store
Working very good yet than the other methods I know before,5,2024-10-30,CBE,Google Play Store
To say frankly this is amazing App Thanks CBE,5,2023-04-02,CBE,Google Play Store
One of a kind app! Just wow!!,5,2023-07-06,CBE,Google Play Store
okay 👍 but sometimes busy,1,2025-05-03,CBE,Google Play Store
Good but i cant rich verification key,5,2021-02-28,CBE,Google Play Store
Not bad app beter than Banke of Abssinya,1,2023-03-30,CBE,Google Play Store
Exelent app it's very help full,5,2022-04-06,CBE,Google Play Store
Until now it is not functional,1,2022-02-12,CBE,Google Play Store
Very interesting application,5,2022-02-20,CBE,Google Play Store
No working perfectly,1,2021-10-11,CBE,Google Play Store
It gives fast service!,1,2024-02-11,CBE,Google Play Store
"It's a wonderful application, I like it",5,2023-04-11,CBE,Google Play Store
very very very useful,5,2019-03-17,CBE,Google Play Store
This one of the best app for my money 😜,5,2022-08-05,CBE,Google Play Store
Very Nice Application.,5,2020-08-07,CBE,Google Play Store
It is very good application,5,2023-02-03,CBE,Google Play Store
"It's a great app, thank you",5,2023-02-21,CBE,Google Play Store
Thanks for this multiple purpose app,4,2022-02-12,CBE,Google Play Store
This is really fantastic app,5,2020-08-24,CBE,Google Play Store
Please Add the Biometric system on the app,5,2024-12-15,CBE,Google Play Store
So very important app very useful.,5,2024-08-06,CBE,Google Play Store
It is very important apk.,5,2024-05-09,CBE,Google Play Store
We need update How to updated the app,3,2023-03-23,CBE,Google Play Store
What is the verification code ? And how to get it? why?,4,2021-09-30,CBE,Google Play Store
The app asks me to write verifcation number where can i get it?,5,2021-01-09,CBE,Google Play Store
CBE is a great way to use it.,4,2024-10-04,CBE,Google Play Store
They don't deserve even half star The worst bank I ever use it.,1,2022-01-28,CBE,Google Play Store
why can't sync all day while there is Internet pls fix it ASAP,1,2024-01-01,CBE,Google Play Store
Stop working after 2 days of installation,2,2020-11-02,CBE,Google Play Store
Failed to use mobile banking,5,2022-02-18,CBE,Google Play Store
Very nice application 👍.,5,2021-02-08,CBE,Google Play Store
Please try to link the updated version.,2,2019-03-19,CBE,Google Play Store
It is best and fast,5,2023-06-05,CBE,Google Play Store
Not fun.....not lively Its 2022 and counting u guys suck,1,2022-04-04,CBE,Google Play Store
what is the application verification key pls??,4,2021-06-02,CBE,Google Play Store
Never works abroad,1,2021-03-27,CBE,Google Play Store
Not always good It is helpfull,5,2022-03-29,CBE,Google Play Store
It's very nice more better from this .,5,2021-09-15,CBE,Google Play Store
Perfect app i love it,5,2022-07-02,CBE,Google Play Store
The update is awesome,5,2020-08-14,CBE,Google Play Store
Fast and good app🙏,3,2024-02-24,CBE,Google Play Store
Am happy to use the app.,5,2023-01-02,CBE,Google Play Store
Best app It's user friendly,5,2021-10-16,CBE,Google Play Store
I like this App. Very much.,5,2020-09-01,CBE,Google Play Store
Very god active app i liked it,4,2024-02-08,CBE,Google Play Store
Simple & easy!,5,2022-02-12,CBE,Google Play Store
Why my app speed quality is low,3,2024-02-18,CBE,Google Play Store
It is very useful app I like it to use,1,2022-04-01,CBE,Google Play Store
it's great & useful app,4,2024-02-23,CBE,Google Play Store
Experience for free of charge payment,5,2022-03-22,CBE,Google Play Store
I can't hide my balance on this app like CBE App on iphone,5,2021-05-02,CBE,Google Play Store
My application was blocked what is the reason?!,5,2021-03-07,CBE,Google Play Store
wow!!! so much nice app!!!,5,2024-02-14,CBE,Google Play Store
It is good useful app thank you,5,2023-09-11,CBE,Google Play Store
good app 10 q commercial bank of ETHIOPIA,5,2020-09-21,CBE,Google Play Store
Wow good app.....easy to use.....,5,2022-12-12,CBE,Google Play Store
The best bank app !!!,5,2023-01-01,CBE,Google Play Store
